{
  "$ref": "#/definitions/leads",
  "definitions": {
    "leads": {
      "type": "object",
      "properties": {
        "id": {
          "type": "string"
        },
        "name": {
          "type": "string"
        },
        "email": {
          "type": "string",
          "format": "email"
        },
        "phone": {
          "type": "string"
        },
        "company": {
          "type": "string"
        },
        "propertyInterested": {
          "type": "string"
        },
        "message": {
          "type": "string"
        },
        "source": {
          "type": "string",
          "default": "website"
        },
        "createdAt": {
          "type": "string"
        },
        "status": {
          "type": "string",
          "enum": [
            "new",
            "contacted",
            "qualified",
            "closed"
          ],
          "default": "new"
        },
        "notes": {
          "type": "string"
        },
        "$schema": {
          "type": "string"
        }
      },
      "required": [
        "id",
        "name",
        "email",
        "phone",
        "message",
        "createdAt"
      ],
      "additionalProperties": false
    }
  },
  "$schema": "http://json-schema.org/draft-07/schema#"
}