{
  "id": "lead-003",
  "name": "Michael Rodriguez", 
  "email": "m.rodriguez@retailco.com",
  "phone": "(555) 456-7890",
  "company": "RetailCo Distribution",
  "propertyInterested": "25,000 SF with dock doors",
  "message": "Expanding our South Florida operations and need a large distribution facility with multiple dock doors and good truck access.",
  "source": "website", 
  "createdAt": "2025-01-10T09:15:00Z",
  "status": "qualified"
}